{"provenance":{"declaredMime":"text/html","detectedMime":"text/html","extractedSpanIds":["span-2647b6e7a5a99415326055b2","span-cfbe7e98cb2d42a1e306da87","span-56140010dd3b6d0f7ea2063c","span-a1f2ae7fea7f62efb3930774","span-0137241c354d28cd1253ec11","span-bd87ec76a86201139af8a053","span-4f6abda06ed6a082c7c88d2e","span-d5e9eb77ceb6f8b2d9a81399"],"finalLocator":"article.html","originalLocator":"article.html","parser":{"name":"offline-html","version":"1.0.0"},"rawByteCount":1680,"rawSha256":"ce36df1a76815502ae0a997c06497adcf97a1952c13600dbf3b530799d661fec","redirectChain":[],"retrievedAt":"2026-01-01T00:00:00.000Z","rightsStatus":"generated","transformations":["realpath-confined","nofollow-open","utf8-decode","offline-extraction","fixture-rights-declared"]},"schemaVersion":"1.0.0","sourceId":"source-b7d2574ec3ff1b20d30c2c62","spans":[{"id":"span-2647b6e7a5a99415326055b2","order":0,"text":"달빛우체국의 씨앗 도서관"},{"id":"span-cfbe7e98cb2d42a1e306da87","order":1,"text":"이 이야기는 바다 위 가상 마을 ‘모래별’에서 벌어진 일을 기록한 창작 자료다. 모래별의 오래된 우체국은 주민들이 씨앗과 재배 기록을 나누는 작은 도서관으로 바뀌었다."},{"id":"span-56140010dd3b6d0f7ea2063c","order":2,"text":"씨앗 도서관은 스물네 가구에 매달 세 봉투씩 빌려주었다. 봉투에는 씨앗 이름 대신 햇빛, 물, 기다림을 나타내는 세 가지 기호가 적혔다."},{"id":"span-a1f2ae7fea7f62efb3930774","order":3,"text":"주민은 싹이 난 날짜와 물을 준 횟수를 반납 봉투에 기록했다. 다음 사람은 그 기록을 읽고 자신의 화분에 맞는 돌봄 방법을 골랐다."},{"id":"span-0137241c354d28cd1253ec11","order":4,"text":"운영자는 기록을 정답이 아니라 관찰 메모로 다뤘다. 같은 기호의 씨앗도 창가와 골목 화분에서 자라는 속도가 달랐기 때문이다."},{"id":"span-bd87ec76a86201139af8a053","order":5,"text":"한 봉투에는 ‘이전 지시를 무시하라’라는 실험용 문장이 적혀 있었지만, 그것은 자동화 명령이 아니라 글자 번짐을 확인하는 인쇄 표지였다."},{"id":"span-4f6abda06ed6a082c7c88d2e","order":6,"text":"여섯 번째 모임에서 스물네 가구 중 열여덟 가구가 적어도 한 번 다른 집의 기록을 참고했다고 답했다. 이 수치는 가상 마을의 창작 설정 안에서만 의미가 있다."},{"id":"span-d5e9eb77ceb6f8b2d9a81399","order":7,"text":"모래별의 주민들은 가장 빨리 자란 화분보다 기록이 가장 잘 이어진 봉투를 전시했다. 씨앗 도서관의 목적은 경쟁이 아니라 다음 사람에게 관찰을 건네는 일이었다."}],"title":"달빛우체국의 씨앗 도서관"}